,country,description,designation,points,price,province,region_1,region_2,variety,winery
330,Germany,Touches of autumn leaves and dried herbs lend a savory feel to this dry and tightly composed Riesling. Bracing acidity and savory apple and pear flavors mark the palate.,Gutsriesling Dry,87,21,Nahe,,,Riesling,Mathern
331,US,"Fresh cantaloupe aromas, mouth-filling pear and peach flavors and a generous texture make this an extroverted wine that could make a great pairing with salty cheeses. It is full bodied, very smooth-textured and long on the finish, where honey and vanilla flavors echo.",,87,11,California,River Junction,Central Valley,Viognier,McManis
332,Germany,"Flirty and floral, this sunny off-dry Pinot Noir rosé (blended with a touch of Dornfelder) offers forward fruitiness in an elegant frame. With a kiss of strawberry and cherry flavors, it's an accessible, yet satisfying quaffer.",,87,23,Mosel,,,Rosé,HPSepicurean
333,Argentina,"Raspberry and cherry aromas are mild while not stirring much excitement. This feels a bit raw and tannic, but it's got enough body to hold up. Berry and plum flavors finish with hints of spice and chocolate.",Premium Reserve,87,17,Mendoza Province,Luján de Cuyo,,Cabernet Sauvignon,Piattelli
334,Spain,"Earthy plum and stalky berry aromas are bolstered by bold oak aromas. This feels good and healthy, with spicy oaky flavors that are dry lactic and push the wine's fruit to the background. A woody spicy, minty finish ends this. Drink through 2017.",Crianza,87,13,Northern Spain,Rioja,,Tempranillo,Ramón Bilbao
335,Australia,"Cedar and vanilla notes mark the nose of this wine, which boasts ample weight, modest fruit and a soft, open-knit texture. It's appealing for its oaky charm.",,87,20,South Australia,Adelaide Hills,,Pinot Noir,Sidewood
336,Argentina,"Reduced rubbery aromas of blackberry and black currant come with a touch of mushroom. This is extracted, heavy and blocky on the palate, while baked blackberry flavors are massive but short on elegance. Bitter coffee flavors, rugged tannins and stickiness make for a heavy finish.",La Encerrada Estate Vineyard,87,16,Mendoza Province,Mendoza,,Malbec,Benegas
337,Italy,"Bracing and tightly wound, this opens with subdued aromas of pressed rose, resin and a whiff of exotic spice. The evolved palate isn't in sync with the nose, offering raisin and a touch of anise as well as aggressive, astringent tannins that give it an abrupt, raspy finish. It's already drying out so drink now.",Roggeri Riserva,87,70,Piedmont,Barolo,,Nebbiolo,Ciabot Berton
338,Germany,"Luscious honeyed tangerine and yellow peach notes are offset by a streak of minerality in this easy, off-dry Riesling. It's delicate in body yet juicy and refreshing. Drink now.",Kabinett,87,13,Rheinhessen,,,Riesling,Dr. Volkmar
339,Italy,"Aromas of oak, toast, coconut and dark berry lead the nose and carry over to the bracing palate along with white pepper and oak-driven spice. Firm, extremely astringent tannins give this a bracing finish. Drink after 2018.",Sergentin,87,25,Piedmont,Roero,,Nebbiolo,Fabrizio Battaglino
340,US,"This medium-bodied, understated wine has a rather light red color with brown undertones. It offers subtle earthy and smoky aromas, tart fruit flavors like cranberries, and an appropriately tannic texture. While its flavors are subtle, the balance is great and this wine stayed fresh for three days after opening.",,87,18,California,Amador County,Sierra Foothills,Sangiovese,Noceto
341,US,"It's a midnight-black wine, full-bodied and tannic, with immense black currant, grilled meat and black pepper flavors that finish bone dry. Already throwing some sediment, it will live for two decades, without gaining in complexity. Drink now–2025.",,87,28,California,Santa Barbara County,Central Coast,Petite Sirah,Santa Barbara Winery
342,US,"Coming from the cool 2010 vintage, this 100% varietal wine doesn't quite seem to have fully ripened but still offers plenty of enjoyment with its savory notes of leafy herbs, olive and cherry. It's elegant in its styling with a fresh feel and a cinnamon-speckled finish.",,87,40,Oregon,Applegate Valley,Southern Oregon,Cabernet Sauvignon,Schmidt
343,France,"In this crisp, fresh, very dry rosé Champagne, the red fruits are laced with acidity and apple. A touch of bitterness suggests the wine needs to age a few months in bottle, to soften and get a more generous feel.",Cuvée Rosé Brut,87,59,Champagne,Champagne,,Champagne Blend,Tendil & Lombardi
344,US,"Racy acidity and oak-inspired lemon, lime and tropical fruit flavors mark this bone-dry, elegant wine, with a minerally edge. Don't drink it too cold.",Reserve,87,35,California,Russian River Valley,Sonoma,Chardonnay,Windsor Oaks
345,France,"Simple but with depth, this wine has structure and some good tannins, along with the bright cherry fruit flavors and balanced acidity. It's a wine to drink now, full of flavor and ripe fruits.",,87,,Beaujolais,Beaujolais,,Gamay,Domaine de la Prébende
346,US,"This brightly acidic, clean wine doesn't appear to have any oak influence. What you get are pure, ripe orange, Meyer lemon, lime and peach flavors that finish honeyed, yet dry. It's an easy wine to drink with many foods.",,87,7,California,California,California Other,Pinot Grigio,flipflop
347,US,"This single-vineyard selection is aggressively tannic, earthy and herbal. Time may help smooth it out. There's plenty of black fruits and dark chocolate, and chewy, somewhat rough tannins.",Bjornson Vineyard,87,36,Oregon,Eola-Amity Hills,Willamette Valley,Pinot Noir,Grochau
348,US,"Richness and rusticity ride side by side in this Pinot Noir. It has enormously ripe raspberry, cherry and persimmon flavors, with a balanced jacket of oak and crisp acidity. On the other hand, the tannins are edgy, giving the wine a jagged feeling. The wine will age for many years, without gaining complexity.",Soberanes Vineyard,87,55,California,Santa Lucia Highlands,Central Coast,Pinot Noir,Bernardus
349,Italy,"Subdued aromas recall Alpine wild flowers and lychee. The fresh, linear palate offers Golden Delicious apples and citrus notes with a hint of wax alongside crisp acidity.",Vom Stein,87,17,Northeastern Italy,Alto Adige,,Pinot Bianco,Castelfeder
350,France,"Chatons, which means “kittens,” indicates this is a younger style of wine from Château du Cèdre. The dark, perfumed, mint and black berry flavored fruits give richness and precociousness. The wine is going to develop over the short term so drink from 2016.",Chatons du Cèdre,87,,Southwest France,Cahors,,Malbec-Merlot,Château du Cèdre
351,US,"An unusual blend of Zinfandel, Petite Sirah and Teroldego, this red wine is dry and tannic. The blackberry, currant, mocha and white pepper flavors are drinking well now.",Sorcerer's Stone,87,45,California,California,California Other,Red Blend,Cinnabar
352,Italy,"This wine opens with an intense bouquet of white roses with accents of baking spices. The flowery sensation carries over to the palate along with ripe banana, pear and clove, plus the heat of alcohol. It concludes with a slightly sweet finish.",Movado,87,48,Northeastern Italy,Alto Adige,,Gewürztraminer,Andriano
353,Portugal,"Very Douro in its mineral texture and dry core, it also has a surround of ripe black fruits. It's concentrated and has some aging potential, although it can be drunk now.",Porrais,87,13,Douro,,,Portuguese Red,Quinta de Porrais
354,Portugal,"Still young, it is full of spice from wood aging along with juicy black fruits. It is soft, dominated by black currant and acidity. Not for aging, it will be ready by the end of 2014.",,87,,Tejo,,,Portuguese Red,Quinta do Casal Branco
355,Chile,"Reedy berry aromas mixed with herbal notes set up a chunky, voluminous palate. Spicy flavors of olive, green herbs, tobacco and oak run alongside berry and plum fruit. On the finish, a resiny oak flavor and herbal notes meld then fade away. This is 55% Carmenère, 30% Petit Verdot and 15% Syrah.",Anke Blend 2 Carménère-Petit Verdot-Shiraz,87,15,Maipo Valley,,,Red Blend,Santa Alicia
356,France,"A ripe, rich and deliciously spicy wine, it has a light touch of white pepper, red berry fruits and a broad brush of acidity. It's rounded, although with some tannic structure, and can certainly be drunk now.",Merlot/Duras,87,13,Southwest France,Côtes du Tarn,,Red Blend,Domaine D'en Ségur
357,US,"This Merlot-based blend is dry, hard in tannins and brisk in acids. It has an intense core of blackberries, black currants and oak. Ready to drink now, it needs rich, oily foods, like short ribs, to cut through the astringency.",The Immigrant,87,40,California,Paicines,Central Coast,Bordeaux-style Red Blend,Donati
358,US,"Notable for a soft, buttery creaminess that makes it feel caressing in the mouth. There's just enough acidity to give a boost to the intense lemondrop candy, pineapple, crème brulée and vanilla flavors. Drink up with roast chicken, grilled salmon or portobello mushroom risotto.",,87,22,California,Sta. Rita Hills,Central Coast,Chardonnay,Gainey
359,Portugal,"This wine shows its high alcohol with pepperiness and too much fruit richness. There is certainly power there, followed by superripe plums and dark tannins that are almost enveloped by the fruitiness. Drink from 2015.",Colheita Seleccionada,87,14,Alentejano,,,Portuguese Red,Herdade das Servas
360,Portugal,"A wine that packs a punch of black fruits and dark tannins, it is very structured. Still dense and dry, it needs to soften so the berry fruits will show, giving a rich wine with a fresher aftertaste. Drink from 2016.",Dornas,87,,Alentejano,,,Portuguese Red,Herdade do Rocim
361,US,"Perhaps it's the bottle age but this Zin is plush and voluptuous, bright in red raspberry and blackberry fruit with a smoky undertone. Layered, the texture is dense and the finish long. A good pizza wine.",Family Vine Old Vine,87,18,California,Lodi,Central Valley,Zinfandel,Herman Walters
362,US,"It flatters with ripe apricot, orange, lime and papaya flavors, enhanced with oak and brightened with acidity. Bone dry on the finish, it has a firm edge of minerality.",,87,35,California,California,California Other,Chardonnay,Hoyt Family Vineyards
363,US,"It shows good acidity, a pleasant scour of tannins and complex flavors of raspberries, currants and mushrooms. But a tannic graininess results in a lack of delicacy. Already throwing some sediment, it will age for many years.",Estate,87,60,California,Santa Cruz Mountains,Central Coast,Pinot Noir,Kings Mountain
364,Italy,"Pretty fragrances recall white spring flowers and white fruit. The bright palate offers juicy Granny Smith, yellow peaches and citrus alongside crisp acidity that leaves a clean, dry finish.",,87,13,Northeastern Italy,Delle Venezie,,Pinot Grigio,Kris
365,US,"The grapes are from Mount Veeder, and the wine shows that appellation's strong tannins, as well as its classic black currant and mineral flavors that finish so dry and clean. Made from 100% Cabernet, it was aged in 50% new French oak. The end result is complex, but astringent, not a wine you want to drink now. Give it until 2020 and see what it's doing.",,87,79,California,Napa Valley,Napa,Cabernet Sauvignon,Kukeri
366,US,"This is one of those Chardonnays that's delicious from the first sip. It's not complicated, but is rich in mango, yellow peach and oak-inspired buttered toast, butterscotch, honey and vanilla bean flavors. The grapes are from the Oak Knoll District, and the wine has refreshing acidity.",Red Hen,87,30,California,Napa Valley,Napa,Chardonnay,Laird
367,Italy,"This well-priced Moscato offers intense sensations of honeysuckle, tropical fruit, ripe yellow peach and juicy honeydew melon. The palate is brightened by fresh acidity, which imparts a lively, bright character.",,87,9,Northeastern Italy,Vigneti delle Dolomiti,,Moscato,Mezzacorona
368,Italy,"Aromas include white spring flowers, tropical fruit and a hint of graphite. The juicy palate offers green apples, white peach and melon alongside fresh acidity. Delicate almond marks the close.",Montunal,87,15,Lombardy,Lugana,,Turbiana,Montonale
369,US,"Fragrant in tropical guava and grapefruit, this is a clean, crisp Chardonnay. Layered with acidity and textured enough to go with food, it's a good wine to serve on occasions big and small.",Rock & Vine,87,17,California,North Coast,North Coast,Chardonnay,Nine North Wine Company
370,US,"This 100% Merlot has elevated qualities of complexity. It's dry and quite tannic, with raspberry, cherry, licorice, herb and sandalwood flavors that finish with a rich spiciness. Drink now–2016.",,87,27,California,Alexander Valley,Sonoma,Merlot,Pech Merle
371,Argentina,"Sweet and candied on the nose, it has a touch of citrus and melon to the flavor profile. It has an okay mouthfeel.",The Perfect Play Pink,82,7,Mendoza Province,Mendoza,,Moscato,Domino
372,US,"Arabica coffee and toasted hazelnut aromas are layered on top of wild-berry notes. Overall, this medium-bodied wine feels soft and a tad runny.",,82,18,Virginia,Virginia,,Chambourcin,Chateau Morrisette
373,Argentina,"It's oxidized and nutty on the nose. The palate is peachy, while flavors of nuts, dried-out citrus and baked stone fruits finish bland.",Made With Organically Grown Grapes Rosé,82,12,Mendoza Province,Tupungato,,Malbec-Cabernet Sauvignon,Domaine Jean Bousquet
374,US,"This is a big Merlot, earthy but a tad flat, with a tobacco-like bitterness on the tail end.",Le Sage,82,35,California,Dry Creek Valley,Sonoma,Merlot,Michel-Schlumberger
375,France,"Cut with sulfur, this is a wine whose bitterness hides the potential of the strawberry fruits and acidity. Off-dry, it's unbalanced.",,82,13,Loire Valley,Rosé d'Anjou,,Rosé,Bougrier
376,Portugal,"A sugar water style of Vinho Verde, all sweetness and acidity. It is fresh and clean, very crisp and green.",,82,9,Vinho Verde,,,Portuguese White,Vidigal
377,US,"Diminished scents of rubber, dried cherry and raspberry translate onto the nimble, glossy palate. The acidity becomes jumpy on the finish, leaving the wine feeling tense and asymmetrical.",Catamount Run,82,18,Virginia,Virginia,,Red Blend,Naked Mountain
378,US,"Oregano, sun-dried grass and vanilla scents veneer seemingly volatile notes of plum and blackberry. Although the wine comes with a supple attack, high-strung acidity marks the midpalate, which makes the wine feel stressed and uneasy.",Estate Club Free Run,82,18,Virginia,Virginia,,Cabernet Sauvignon,Veramar
379,Spain,Compost aromas and a clunky feeling palate get this off on the wrong foot. Flavors of burnt berry fruit and sweetness fail to impress. This shows hardly any snap on a cloying finish.,Rosado,82,14,Northern Spain,Somontano,,Cabernet Sauvignon,Enate
380,US,"There's a tannic flatness to this 76% Cabernet Sauvignon, with 12% Malbec and 12% Petit Verdot blended in. The crunchy blackberry and cassis fall somewhat flat on the palate.",,82,32,California,Sonoma County,Sonoma,Cabernet Sauvignon,Estate 1856
381,US,"Silky and easygoing on the palate, this comes with slightly sweet flavors of shaved apples, pears and tropical fruits.",Sweet Adeline,82,19,Arizona,Arizona,,Riesling,Carlson Creek
382,US,"Course and snappy on the palate, this blanc de blancs features broad apple flavors.",Château Reserve Méthode Champenoise Blanc de Blancs Brut,82,30,North Carolina,North Carolina,,Chardonnay,Biltmore Estate
383,US,"A Grenache-based rosé, this features broad aromas of tart red fruits and an edgy, medium-bodied palate.",Rosa Dia Estate,81,18,North Carolina,Yadkin Valley,,Rosé,Jones von Drehle
384,US,"A vivid floral aroma pops from the glass and carries through to the palate, blending orange blossom with bursts of cherry, orange and red vermouth. It's smooth in texture, full-bodied and not very tannic.",,81,20,California,El Dorado County,Sierra Foothills,Grenache,Four Fields
385,Argentina,"Soapy, funky aromas feel unfocused, with bland flavors of melon and not much else. It finishes soft.",,81,13,Mendoza Province,Mendoza,,Torrontés,Tres Exilios
386,US,"A rosé of Sangiovese, Montepulciano and Syrah, this has flavors of herb and raspberry, which are etched with nervy acids.",Girasole,81,13,North Carolina,Swan Creek,,Rosé,Raffaldini
387,US,"Quince and apple juice notes lead to a tart, medium-bodied palate. The elevated acidity makes for a rigid finish.",,81,14,Virginia,Virginia,,Traminette,Virginia Mountain Vineyards
388,US,"Medium in body, this deals a slender peach flavor, bearing acids that become jumpy toward the finish.",,81,20,Virginia,Virginia,,Viognier,North Gate
389,Argentina,"Vaguely floral aromas precede a sweet, cloying palate that tastes candied.",,81,8,Mendoza Province,Mendoza,,Moscato,Region 1
390,US,"A ripe-smelling wine, with notes of wilted flower, lychee and papaya flesh. It feels amorphous on attack, and the clingy finish shows some bitterness.",Vino Signora,81,15,Virginia,Monticello,,Traminette,Glass House
391,France,"In this unbalanced, medium-dry wine, the fruit, the acidity and the sweetness don't seem to want to hang together. At the end, the acidity wins, while the rest of the wine is left behind.",V Douce France,81,14,Loire Valley,Vouvray,,Chenin Blanc,Bougrier
392,US,"Kiwi, mint and green apple notes mark the nose. Medium in weight, it features seemingly underripe acids that give the palate a discernible nerviness.",,81,15,Virginia,Virginia,,Viognier,Prince Michel
393,US,"Aromas of worn saddle leather and stewed blackberries and raspberries come with some volatility. Overall, the palate feels taut and tense. Tart acids cut the finish short and kick the salivary glands into overdrive.",Ameritage Estate Club,81,18,Virginia,Virginia,,Red Blend,Veramar
394,Argentina,"Tropical, soapy aromas are yeasty and flat. Flavors of lychee and melon have no follow-through and finish mealy.",,80,13,Mendoza Province,Mendoza,,Chardonnay,Tres Exilios
395,Argentina,"Candied plum and red berry aromas smell like red licorice. Flavors are raisiny, with sourness and astringency.",Estate Bottled,80,5,Mendoza Province,Mendoza,,Malbec,Terrenal
396,US,"The color of castor oil, this sweet table wine offers clove and root beer flavors that cling to the finish.",Noche Sweet Table Wine,80,17,Virginia,Virginia,,Red Blend,Cooper Vineyards
397,France,"This is full of fruit and weighty tannins. Coming from one of the finest vineyards in Burgundy, it is going to have great power and an opulent nature. This wine also has elegance, its black fruits controlled and with a mineral edge. That doesn't take away the power, it enhances the stylishness of this grand wine. Drink from 2020.",,96,240,Burgundy,Chambertin,,Pinot Noir,Domaine Rossignol-Trapet
398,Spain,"This could be the best Astrales to date. Alluring scents of plum, blueberry and spice are backed by balsam dust and briary pipe-tobacco aromas. Deep and tannic on the palate, then packed with mocha, chocolate, toasted marshmallow, cassis and cherry cough drop flavors, this is fixed and firm now, with a staunch, intense, nervy finish. Drink from 2015–2028.",,96,90,Northern Spain,Ribera del Duero,,Tinto Fino,Astrales
399,France,"Initially, this is a richly ripe wine with tropical fruit flavors. It also has an immense sense of structure that supports the fruit impressively. It's dense, concentrated, exuding power and solidity, while always keeping a sense of elegance. Drink from 2018.",,96,315,Burgundy,Chevalier-Montrachet,,Chardonnay,Bouchard Père & Fils
400,France,"This is powerful and rich, allowing just a note of freshness to creep into the firm structure. Dark tannins, black fruits and smoky wood flavors combine harmoniously, lending a sense of great power and long-term aging potential. Drink from 2019.",Le Corton,96,115,Burgundy,Corton,,Pinot Noir,Bouchard Père & Fils
401,US,"Half Cabernet Sauvignon with the rest Merlot and Cabernet Franc, this wine opens with aromas of fresh herbs, fig, barrel spice and dark fruit. The palate brings some astringency, needing some food to tame it.",Ciel du Cheval Vineyard,87,40,Washington,Red Mountain,Columbia Valley,Bordeaux-style Red Blend,:Nota Bene
402,Italy,"Ripe plum, game, truffle, leather and menthol are some of the aromas you'll find on this earthy wine. The tightly wound palate offers dried black cherry, chopped sage, mint and roasted coffee bean alongside raspy tannins that leave a mouth-drying finish.",,87,40,Tuscany,Brunello di Montalcino,,Sangiovese,Poggiarellino
403,France,"Herb and cherry notes mingle on the nose of this 75% Grenache and 25% Syrah blend. On the medium-weight palate, pleasant pepper, cinnamon and clove notes join the ripe cherries, then conclude with a hint of mocha. Drink now–2020.",,87,14,Rhône Valley,Côtes du Rhône,,Grenache-Syrah,Republic of Wine
404,US,"Gravel, dark red berries and a raw beef character show on the nose of this accessibly priced wine. The palate offers beet and dark cranberry juice flavors, along with black sage and camphor. Still tightly wound, it will get better with patience.",,87,18,California,Santa Barbara County,Central Coast,Pinot Noir,Santa Barbara Winery
405,India,"This wine features a fresh nose of grapefruit and lemon peel. It is bright on the palate, offering flavors of grapefruit, pear and green apple. It remains crisp and clean across the entire tongue right into the orange zest finish.",,87,12,Nashik,,,Chenin Blanc,Sula
406,Italy,"Aromas of stewed prune and fig follow through to the evolved palate along with raisin, licorice and a green note of powdered sage. Austere, astringent tannins leave a raspy finish. You'll also notice the heat of evident alcohol.",Vigna Spuntali,87,70,Tuscany,Brunello di Montalcino,,Sangiovese,Val di Suga
407,Italy,"Made with organically grown Sangiovese grapes, this structured red has subdued aromas of mature black cherry, blue flower and baking spice. The soft palate offers prune and sweet vanilla alongside rather fleeting tannins.",Saragio,87,32,Tuscany,Maremma Toscana,,Sangiovese,Valdonica
408,Spain,"Light cherry and raspberry aromas are subdued but fresh. This blend of 85% Tempranillo and Cabernet Sauvignon has a medium body, while plum and cherry flavors are straightforward. A lightly baked flavor and spice notes help the finish along, as does the jolt of Cabernet.",Hoya de Cadenas Reserva Privada,87,12,Levante,Utiel-Requena,,Tempranillo Blend,Vicente Gandia
409,US,"Barrel notes of spice, vanilla, caramel and herbs lead to red- and blue-fruit flavors, with the tannins showing some astringency. Merlot wouldn't be a first guess but it still brings appeal.",,87,14,Washington,Columbia Valley (WA),Columbia Valley,Merlot,Waterbrook
410,US,"The aromas of plum, blackberry, vanilla, dried herbs and spice provide intrigue. The blue- and black-fruit flavors are linear in style but deliver enjoyment.",,87,14,Washington,Columbia Valley (WA),Columbia Valley,Syrah,Waterbrook
411,US,"The green apple, apple skin and flower aromas pop. The off-dry peach flavors keep you coming back for more.",,87,10,Washington,Columbia Valley (WA),Columbia Valley,Riesling,Whispering Tree
412,Spain,"Dusty, gritty citrus aromas are softened by leesy notes and a vanilla scent. The palate is foamy and short on complexity. Flavors of orange, nectarine and white pepper turn slightly bitter, while citric acidity lends freshness to the finish.",Natura Brut,87,42,Central Spain,La Mancha,,Sparkling Blend,Alcardet
413,France,"Packed with fruit and crisp acidity, this is a bright, light and perfumed wine. Red-berry flavors are lifted by red currants and a light spice. Drink now for total freshness.",,87,22,Loire Valley,Sancerre,,Rosé,Bernard Reverdy et Fils
414,US,"There's a seltzer quality to the nose of this wine, with aromas of pink-grapefruit spritz, apple and pear cider, and fresh baking soda. It's tight and grippy on the palate, with flavors of green-apple flesh and tangerine skin that linger into the finish.",,87,24,California,Paso Robles,Central Coast,Albariño,Broken Earth
415,Italy,"Baked plum, roasted coffee bean, toast and a whiff of grilled herb lead the nose. The concentrated palate offers dried black cherry, blackberry jam and licorice alongside assertive tannins that leave a mouth-puckering finish. The fruit is showing signs of drying out so drink sooner rather than later.",,87,,Tuscany,Brunello di Montalcino,,Sangiovese,Colombaio
416,US,"This closed, youthful wine is wrapped up in the ripeness and grippy nature of the vintage. It has a tropical edge to the fruit, a mix of pineapple and guava supported by juicy peach that finishes full bodied and lush on the palate.",,87,40,California,Sonoma Coast,Sonoma,Chardonnay,Corner 103
417,France,"Based in Humbligny, midway between Menetou-Salon and Sancerre, this producer has vines in both appellations. A delicate, perfumed wine, this enjoys a good balance between acidity and apple and white peach flavors. It's rounded, full in the mouth and ready to drink.",,87,25,Loire Valley,Sancerre,,Sauvignon Blanc,Domaine de Champarlan
418,France,"A light approach to Chablis, this brings out crisp fruitiness, attractive acidity, apple flavors and a touch of steeliness. With its creamy, ripe aftertaste, the wine is ready to drink.",,87,25,Burgundy,Chablis,,Chardonnay,Domaine Louis Moreau
419,France,"From the Mâcon appellation that is dominated by the formidable rock of Solutré, this is a ripe, full-bodied wine. It offers juicy acidity, fresh sliced apple flavors and a touch of spice. The wine is ready, although it will be better from late 2016.",,87,27,Burgundy,Mâcon Solutré,,Chardonnay,Domaine Trouillet
