,country,description,designation,points,price,province,region_1,region_2,variety,winery
1067,Spain,"The aromas of this wine are gummy and candied on the nose. Weird flavors of pastry, mulched earth and clay are devoid of clean fruit and finish jumbled and flat.",Unus Old Vine,80,12,Northern Spain,Calatayud,,Garnacha,Agustín Cubero
1068,US,"This wine is flawed, with rustic leathery undertones that veer into Band-Aid, and an intensely sour note. Multiple bottles tried over several months.",Carneros Estate,80,30,California,Carneros,Napa-Sonoma,Pinot Noir,Peter Cellars
1069,US,"This Merlot has not fully ripened, with aromas of bell pepper, green herbs and savory notes overriding any sense of variety. Flavors are faint and lighter in style, trailing on the finish.",,80,20,Washington,Horse Heaven Hills,Columbia Valley,Merlot,James Wyatt
1070,Spain,"Rusty in color, with rubbery cherry and raspberry aromas, this is a sticky, candied rosé with a low freshness quotient. Candied, sugary flavors finish sweet and gooey.",Alone,80,8,Levante,Alicante,,Rosé,Bocopa
1071,US,"Hard to like, with vegetal and sugared raspberry flavors.",,80,13,California,California,California Other,Zinfandel,Forbidden Zin
1072,US,"This wine has a plethora of green pepper going on, and not in a particularly pleasant way.",,80,28,California,Sonoma Valley,Sonoma,Cabernet Sauvignon,Hannah Nicole Vineyards
1073,US,"Barely acceptable, it's so vegetal, with a steamed asparagus edge. Saved by a hint of blackberry.",,80,17,California,Sonoma County,Sonoma,Cabernet Sauvignon,Shiloh Road
1074,Argentina,"Smells gaseous and murky, like a compost pile. Rough and not well balanced in the mouth, with simple berry and burnt brown sugar flavors. Hot, heavy and barely acceptable.",,80,13,Mendoza Province,Mendoza,,Merlot,Alberti 154
1075,Argentina,"While this smells floral and candied, the palate rages, courtesy of strapping acidity that creates tart plum and blueberry flavors.",,80,5,Mendoza Province,Mendoza,,Malbec,Toca Diamonte
1076,US,"This blend of 45% Cabernet Sauvignon, 45% Merlot and 10% Syrah was too sweet for this taster. It's full of huge ripe fruit and a lingering aroma of burnt toast.",The Other,80,12,California,Lodi,Central Valley,Red Blend,Peirano
1077,Spain,Loud citrus and berry aromas precede an overloaded palate that carries stalky plum flavors. Pickled tasting on the finish.,Tempranillo,80,9,Northern Spain,Vino de la Tierra de Castilla y León,,Rosé,Peñascal
1078,Spain,"Salmon in color, this is pulpy and perfumed on the nose, with an artificial leaning. Overly foamy on the palate, this has a bitter, herbal flavor.",Vega Medien Brut Rosé,80,10,Catalonia,Cava,,Garnacha,Unión Vinícola del Este
1079,US,"A barrel fermented Chardonnay that is uncharacteristically soft and fruity. Aromas of bananas and bubble gum lead to slightly sweet, uncomplicated flavors. The texture and body are light.",,80,10,California,Lodi,Central Valley,Chardonnay,Campus Oaks
1080,Spain,"Sweet melon and peach aromas are candied. In the mouth, this is awkward, fizzy and cloying. The flavor profile has little positive to offer, while the finish turns bitter and grassy tasting.",234,80,17,Northern Spain,Somontano,,Chardonnay,Enate
1081,Spain,"The cold, rainy conditions of 2008 must have affected this wine. Vegetal aromas, vinegar and green notes drive the nose, while the flavor profile is briny and pickled to an extreme. High acidity and green flavors draw down the finish.",Reserva,80,40,Northern Spain,Rioja,,Tempranillo Blend,Finca Valpiedra
1082,Chile,"Another subpar Chardonnay from this winery. It smells like rubber bands and bacon, while the palate is heavy and tastes of hickory, sweet apple and sugar. Recent vintages of this wine have been weak.",Reserva,80,12,Colchagua Valley,,,Chardonnay,MontGras
1083,Chile,"Overloaded with tomato, green bean and bell pepper on the nose. Not much changes in the mouth; it's herbal and tomatoey, with oregano and chili pepper flavors. A green, herbal wine made from four grapes, led by Merlot.",Quinteto,80,16,Casablanca Valley,,,Red Blend,Lomas del Valle
1084,New Zealand,"A disappointing effort, showing a weedy, hay-like profile and fruit that is drying out on the finish. Barely acceptable.",,80,19,Awatere Valley,,,Pinot Noir,The Crossings
1085,Spain,"Tan like cream soda, with a weird, faded bouquet of banana pudding and resiny oak. Soft and weakly structured except for lasting acidity, while it tastes like fermented apples and finishes on bitter walnut. A strange bird made from Sauvignon Blanc and white Tempranillo.",Peñalba López,80,22,Northern Spain,Vino de la Tierra de Castilla y León,,White Blend,Finca Torremilanos
1086,Argentina,"Smells like sweet apple pie and wax. The palate is sticky and out of balance, with papaya, vanilla and mealy white fruit flavors. Not very fresh; seems to already be turning south.",,80,17,Mendoza Province,Mendoza,,Chardonnay,Medanos
1087,Bulgaria,"Confected and soapy with exuberant baby powder and floral tones, this dry, medium-bodied Bulgarian Muskat Ottonel is an uneven, craggy wine with shriekingly high acidity.",,80,9,Bulgaria,,,Muskat Ottonel,Targovishte
1088,Argentina,"Smells like floor polish at first. Gets better with time, but still a weak wine of juicy acids, too much oak, not enough fruit and a grating finish. Does nothing to move the dial forward in terms of Argentine Chardonnay.",,80,13,Mendoza Province,Mendoza,,Chardonnay,Budini
1089,Argentina,"Smells a lot like compost and green herbs. The palate is bitter, hard and stalky, with grassy flavors and a weedy finish. Tastes burnt out, like old coffee grinds and marginal berry fruit.",Reserva,80,15,Mendoza Province,Mendoza,,Malbec,Fioravante
1090,Argentina,"Hot and horsey, and it remains forced and clumsy in the mouth. Tastes more sour than fruity, with a heavy, short, chunky finish. Drinkable only in an extreme situation.",Reserve,80,12,Mendoza Province,Mendoza,,Pinot Noir,Cavas de Chacras
1091,Spain,"Strange yeasty unfocused aromas are unclean. This is flat and spineless, with yeasty papaya flavors. A diluted, leesy finish confirms that it's not ready for prime time.",,80,8,Northern Spain,Cariñena,,Chardonnay,Hawthorne Ridge
1092,Argentina,"Cidery, citric and jumbled on the nose and palate, this is barely cutting it. Briny, limited flavors of mealy citrus fruits finish flat.",1300,80,16,Mendoza Province,Valle de Uco,,Chardonnay,Andeluna
1093,Spain,"This is a heartbeat or two from being DOA. Tan in color with an oily heavy mouthfeel, this tastes oxidized and shows almost no pulse.",Halcon,80,13,Northern Spain,Vino de la Tierra de Castilla y León,,Verdejo,Vega de Tera
1094,Argentina,"Herbaceous red-fruit and forced fiery oak aromas give this a spicy, almost Pinot Noir-like nose. Raw as nails on the palate, this tastes like herbal green strawberry and chemicals. Weedy on the finish.",,80,10,Mendoza Province,Mendoza,,Malbec,Mountain Door
1095,Argentina,"Murky, stewy, soupy aromas deliver little to no freshness or fruit, while the palate is tannic and tastes bitter, mildly weedy and minty. Seems roasted and devoid of quality. Unclean and unimpressive.",Vástago de Gea,80,15,Mendoza Province,Luján de Cuyo,,Cabernet Sauvignon,Staphyle
1096,Argentina,"Shows barely any color and then a hard, vapid, no-fruit bouquet. The mouthfeel is citric and the tastes range from lemon to lemon. Pithy, tart and frankly it's a barely drinkable rendition of Argentina's signature white grape.",Reserva,80,11,Mendoza Province,Mendoza,,Torrontés,Nieto Senetiner
1097,US,"Porty and dull. Almost undrinkable, except for some decent berry and currant flavors.",El Matador,80,22,California,Lodi,Central Valley,Tempranillo,Ripken
1098,Argentina,"Smells like corn stalks and also of oxidation. The palate is wet but shapeless, and the flavors are waxy and jumbled. It's yet another pass-it-by, underperforming Mendoza Chardonnay.",,80,14,Mendoza Province,Mendoza,,Chardonnay,Cinco Sentidos
1099,Argentina,Red in color and flat in terms of bubbles and mouthfeel. It smells and tastes burnt and bitter. This is an odd conconction made from Malbec that's barely acceptable.,Serie Terra Spakling,80,14,Mendoza Province,Mendoza,,Malbec,Viniterra
1100,US,"A blend of five diverse red grapes, this lightly fruity quaffer is almost invisible as far as flavor is concerned. It hits the tongue and vanishes.",Cascade Terrace Red,80,17,Oregon,Rogue Valley,Southern Oregon,Red Blend,Agate Ridge
1101,US,"So vegetal, it's barely drinkable. Cabernets Sauvignon and Franc.",Hawk Red,80,14,California,Santa Ynez Valley,Central Coast,Red Blend,Buttonwood Farm
1102,US,"After the sulfur smell blows off, this wine remains tough in acids and tannins.",,80,18,California,Lake County,Mendocino/Lake Counties,Dolcetto,Rosa d'Oro
1103,US,"Too sweet in sugary blackberry jam to earn a higher score, but if that's your liking, go for it.",Estate Grown,80,20,California,Clear Lake,Mendocino/Lake Counties,Barbera,Rosa d'Oro
1104,Uruguay,"Not very lively or fruity. Vague aromas and flavors of nectarine and citrus are sticky, grabby and bland. Not a good rosé by any measuring stick.",Identity Tannat,80,15,Canelones,,,Rosé,Gimenez Mendez
1105,US,"A mix of disjointed impressions. Some floral notes collide with sour acids, then lead into a confected, candied finish.",,80,12,Oregon,Willamette Valley,Willamette Valley,Pinot Gris,Château Bianca
1106,US,"This Zinfandel is alcoholic, and it's dominated by overripe prune and raisin flavors.",Los Chamizal Vineyard,80,28,California,Sonoma Valley,Sonoma,Zinfandel,Tin Barn
1107,Argentina,"Medicinal and feral on the nose, then heavy, thick and extremely creamy and soft in the mouth, with bland, flat flavors of milk, carob and vanilla. Short on fruit, acidity and purpose.",Colección,80,12,Mendoza Province,Mendoza,,Cabernet Sauvignon-Malbec,Alma del Sur
1108,Argentina,"Heavily vegetal and unclean on the nose, then pickled on the palate, as in sauerkraut. The only thing saving this from the flusher is decent body weight and mouthfeel.",,80,15,Mendoza Province,Mendoza,,Sémillon,Ricardo Santos
1109,Argentina,"Mute on the nose, but heavy in the mouth, with grapefruit and pickled flavors. Finishes pickled and pithy. Already old.",,80,12,Mendoza Province,Mendoza,,Torrontés,Gardel
1110,US,"Harsh and nasty, with insipidly sweet cough medicine flavors and sour acidity. Just barely drinkable.",,80,10,California,California,California Other,Cabernet Sauvignon,Sawbuck
1111,Argentina,"A rough, pinchy nose with leather and funk is no way to begin. The palate stays hard and spiky, with burnt, rustic, murky flavors. Roasted and mossy on the finish, and not very good overall.",Grand Reserve,80,20,Mendoza Province,Mendoza,,Malbec,Cruz Alta
1112,Argentina,"Ashy, green and funky smelling, then sweet, chunky and murky tasting. Nothing is meshing here. It's barely acceptable.",,80,17,Mendoza Province,Mendoza,,Sémillon,Bodega Carmine Granata
1113,US,"A soft, dull, sweet wine, with vegetal flavors that just barely break into sour cherry candy.",,80,10,California,California,California Other,Red Blend,Big House
1114,US,"In a giant-sized 750 ml bottle, this Zin is flat and tastes higher in alcohol than it is.",Ancient Vine,80,25,California,Lodi,Central Valley,Zinfandel,Moss Roxx
1115,Spain,"Herbal and stripped back, with rhubarb aromas and fiery acidity once it hits the palate. Tastes of herbs, tomato and pie cherry. Sour on the finish.",,80,9,Central Spain,Vino de la Tierra de Castilla,,Tempranillo,El Morrión
1116,US,"Fruity and soft, a cloying wine with medicinal cherry flavors.",Kiara Private Reserve,80,20,California,Paso Robles,Central Coast,Syrah,Sylvester
1117,US,"This is a lean, acidic and disagreeable wine. It's unripe and minty, and even slightly vegetal, although there's just enough cherry-berry fruit to squeeze by.",Reserve,80,14,California,Russian River Valley,Sonoma,Merlot,Toad Hollow
1118,New Zealand,"Shows just how difficult 2008 was for Marlborough Pinot Noir, with even this normally reliable producer stumbling at the low end. Roasted tomatoes and herbs finish tart and thin.",Vicar's Choice,80,16,Marlborough,,,Pinot Noir,Saint Clair
1119,US,"A difficult wine to praise. It's tough in tannins, with green, stalky flavors and quite a bit of vegetal unripeness. It's drinkable at a big party.",Lot 2,80,18,California,California,California Other,Zinfandel,Candor
1120,US,"Thin, herbal, and tannic, this does not show much in the way of either varietal character or ripeness.",,80,35,Oregon,Rogue Valley,Southern Oregon,Syrah,Del Rio
1121,Spain,Seems like it's past its sell-by date. Smells musky and tastes sweet and gummy. Candied papaya and mango is about all you get. Low-pulse stuff.,,80,12,Catalonia,Alella,,Pansa Blanca,Marqués de Alella
1122,US,"Why not? Because the wine smells like soap, and tastes chemically. Something went south with this Zin-based blend.",Por que No?,80,25,California,Napa Valley,Napa,Red Blend,Tres Sabores
1123,US,Has extracted pineapple jam flavors and an oaky blanket that doesn't taste natural.,Reserve Selection,80,15,California,Russian River Valley,Sonoma,Chardonnay,Hayman & Hill
1124,France,"The problem with this wine is the wood. There is too much of it, and the toasting is too high, giving a burnt character to the wine. For a 2005, this should be better integrated, and is likely to just dry out.",,80,29,Bordeaux,Graves,,Bordeaux-style Red Blend,Château Tour de Calens
1125,Spain,"Vanilla wafer aromas leave this taster lost. The longer it airs out, the more weird the wine gets. Milk chocolate, vanilla and marshmallow dominate everything from aromas to feel to flavor to finish. A barrel-fermented rosé from Ribera Del Duero: why?",Rosado,80,13,Northern Spain,Ribera del Duero,,Rosé,Prado Rey
1126,Chile,"Untamed and scattershot on the nose, with a strong dose of basil and other green herbs. Feels gummy and flabby, with sweet, bungled flavors that finish bitter and mealy. A wayward, unfocused wine that doesn't do much for the Viognier variety.",Single Vineyard,80,13,Rapel Valley,,,Viognier,Anakena
1127,Spain,"Maderized and corny smelling, with mustard, herbs and flowery notes. Tastes sweet and cidery, with not much vitality. Could be better.",Opera Prima Charmat,80,8,Spain Other,Spain,,Moscato,J. Garcia Carrion
1128,US,"Not exactly undrinkable, but hard to like. It's sweet, hot in alcohol and thin in fruit, with a vegetal finish.",,80,11,California,Paso Robles,Central Coast,Zinfandel,TWODOG
1129,US,"Harsh in texture and unripe, with sharp acids and vegetal flavors. Just barely drinkable.",Esther,80,25,California,California,California Other,Tempranillo,Carivintas
1130,Italy,"Le Balze is mostly Sangiovese, with small components of Cabernet Sauvignon and Cabernet Franc. This vintage opens with beef aromas of bresaola, smoked ham and black pepper. Fruit aromas are almost completely absent.",Le Balze,80,,Tuscany,Rosso di Toscana,,Red Blend,Castel Vecchio
1131,Argentina,"Aggressive lemon-lime aromas are itchy, and the nose turns grassy and green. Overactive in the mouth, and tough to hold on the palate. Just at the level of acceptable; warning signs have been posted.",CJR Blanc de Blancs,80,15,Mendoza Province,Mendoza,,Sparkling Blend,Reginato
1132,US,"A difficult wine to like. Shows a mixture of unripe, herbal flavors with jammy sweet ones. There's also a note of vegetal asparagus all the way through.",,80,35,California,Alexander Valley,Sonoma,Cabernet Sauvignon,Mantra
1133,Argentina,"Candied, jammy aromas don't lead to much of anything. Grating, sour, weak stuff; tomato and bland plum flavors with sour acidity. Barely worth a splash.",Estate Bottled,80,8,Mendoza Province,Mendoza,,Cabernet Sauvignon,Rio Seco
1134,Spain,"Smells like mealy fruit and bananas, while the palate is weak in constitution and a bit spritzy in feel. Tastes like bland white fruits with vanilla. Cloying on the finish.",Dama de Toro,80,11,Northern Spain,Toro,,Malvasia,Bodegas Fariña
1135,Spain,"There's a reason Airén is used as a base grape for brandy and Sherry wines, and it's because it's not up to table-wine quality, even at the value price point. This wine is corny and lacks freshness. It's dull, wayward and offers little to no structure. Barely drinkable.",Airén,80,9,Central Spain,Vino de la Tierra de Castilla,,Airen,Sierra Virgen
1136,Spain,Smells like fruit juice. Overall it's raisiny and pruney. Drinkable but barely. Doesn't bring clarity or proper balance.,Organic,80,16,Central Spain,Vino de la Tierra de Castilla,,Tempranillo,Ardales
1137,Spain,"Stalky and oxidized on the nose, this becomes cidery, high in acid in the mouth, with sour-lemon flavors.",,80,15,Northern Spain,Somontano,,Chardonnay,Idrias
1138,US,This offers allspice aromas around a thin core of hard-to-decipher fruit and a finish that veers into burnt-rubber territory.,Ancient Vine,80,25,California,Lodi,Central Valley,Zinfandel,Moss Roxx
1139,Chile,"Jammy aromas of candied red fruits and raisin lead into the palate, with red-fruit flavors and a sticky, bitter finish.",Reserva,80,15,Itata Valley,,,Carmenère,Männle
1140,US,"This Petite Sirah has a strong aroma of farm and funk, and not much else to distinguish itself.",The Heritage Collection,80,12,California,Lodi,Central Valley,Petite Sirah,Peirano
1141,US,"This Malbec shows massive amounts of barrel influence and a strong element of diesel fuel, which takes a while to blow off.",The Heritage Collection,80,12,California,Lodi,Central Valley,Malbec,Peirano
1142,US,"A pop style of pink wine that the Peter Mondavi family makes from Zinfandel with minor portions of Chenin Blanc and Muscat. It has a light coral color, mild fruit aromas and semisweet red Popsicle flavors.",Willow Springs White,80,8,California,California,California Other,Zinfandel,CK Mondavi
1143,Spain,"This yellow-colored blend is weird and wooly, with aromas of blowsy apricot and herbs. A pulpy, melony palate is creamy and odd in feel, with nectarine and chunky peach flavors that turn rubbery on the finish.",Blanco,80,30,Levante,Valencia,,White Blend,Angosto
1144,US,"Unripe and sour, with ammonia aromas and flavors that barely veer into gooseberries.",Massa Ranch,80,25,California,Yountville,Napa,Sauvignon Blanc,Hopper Creek
1145,US,Syrupy and tired. Not much going on with this raspberry-flavored Zin.,,80,20,California,Sonoma County,Sonoma,Zinfandel,Headbanger
1146,Portugal,"Raw, rustic wine, its tannins hardened by excessive acidity. It just about works as a rough and ready red.",Vale de Lobos,80,12,Ribatejo,,,Portuguese Red,Quinta da Ribeirinha
1147,US,"Shows sugary flavors of apricots, grilled pineapples and vanilla that have a troubling vegetal edge.",Late Harvest,80,25,California,California,California Other,Viognier,Lions Peak
1148,Spain,"An aggressive wine with very little charm or character to back up its edgy verve. The nose is skunky while the palate tastes of pickled red cabbage and sharp berry flavors. A weak product reflective of a cool, nongiving vintage.",,80,10,Northern Spain,Ribera del Duero,,Tempranillo,Condado de Oriza
1149,US,"Dull and vegetal. Tastes like canned asparagus juice, with a squeeze of citrus.",Estate,80,19,California,Rutherford,Napa,Sauvignon Blanc,Sawyer
1150,Spain,"Eggy, sulfuric and gritty on the nose, with acrid, burnt-field aromas. The palate runs toward grapefruit and bland citrus, and the finish is dull. Barely an acceptable effort given the norm these days.",,80,17,Northern Spain,Bierzo,,Godello,Abad Dom Bueno
1151,Spain,"Murky and dusty, with additional nutty, dirty aromas. Not much to say here; the wine is heavy and battles you all the way. The fruit is muddled and tart, and overall the wine is devoid of character.",,80,12,Northern Spain,Ribera del Duero,,Tempranillo Blend,Recorba
1152,Spain,"A gaseous, barnyardy wine from several vintages ago. It's tart and scratchy, with thin herbal flavors of red fruit and tomato. Doesn't seem worth much these days.",Crianza,80,20,Northern Spain,Bierzo,,Mencía,Ribas del Cúa
1153,Argentina,"This is the first Torrontés from Pascual Toso that we've rated, and if it's any indication of what's going on there, then we say stick to the reds. This is a borderline dud, with chunky, hollow flavors and a mealy finish. Not a total mess but not a good, vivacious Argentine Torrontes by any stretch.",,80,12,Mendoza Province,Maipú,,Torrontés,Pascual Toso
1154,Argentina,"The only thing that makes this a gran reserva is the label and the winery's commitment to a big, extracted, heavily oaked wine. It's black as ink but clumsy as can be. Smells and tastes like shoe polish, resin and oily fruit. Not what we're looking for from Argentina, or anywhere for that matter. Barely acceptable. Imported by Carolina Wine Brands USA.",Gran Reserva,80,18,Mendoza Province,Uco Valley,,Malbec,Finca El Origen
1155,Chile,"Having liked the 2007 rosé from Los Vascos, this pickled, citric burner just doesn't cut it. It shows Sauvignon Blanc-like flavors and acidity, while the finish is sour and briney. Devoid of the charm and pleasantries that rosé should deliver.",Los Vascos,80,12,Colchagua Valley,,,Rosé,Domaines Barons de Rothschild (Lafite)
1156,US,Unacceptably harsh and hot with overripe raisiny flavors and charred oak notes. It's like cheap Port with some sweetness.,Onyx,80,40,California,San Luis Obispo County,Central Coast,Red Blend,Silver Stone Winery
1157,US,"Just barely drinkable, with sweet and sour raspberry fruit sauce flavors.",,80,13,California,North Coast,North Coast,Cabernet Sauvignon,Fair Hare
1158,US,"Dull and uninteresting, with some simple apricot flavors and unripe vegetal notes. Acceptable for its dryness and crispness, period.",,80,10,California,Sierra Foothills,Sierra Foothills,Viognier,Soleau
1159,US,"Harsh texture, sharp acidity and green tannins. Won't age.",,80,36,California,Lodi,Central Valley,Petite Sirah,Cantara
1160,US,"Soft, sweet and syrupy, a simple wine with sugared raspberry flavors. But it's clean and drinkable.",,80,9,California,California,California Other,Red Blend,Kumbaya
1161,New Zealand,"Strongly vegetal, with notes of ramps and other odiferous veggies. Disappointing.",Grey Ghost,80,27,Marlborough,,,Sauvignon Blanc,Jackson Estate
1162,Spain,"Red licorice candy on the nose is the only sign of life. Otherwise it's just sour and dried-out, with flavors of citrus and plum skins. Past its prime.",Gran Reserva,80,15,Central Spain,La Mancha,,Tempranillo Blend,Gran Oristan
1163,US,"Heavy, sweet and cloying, with medicinal cherry flavors.",The Heritage Collection,80,12,California,Lodi,Central Valley,Malbec,Peirano
1164,US,As sugary sweet as cherry and raspberry pie filling. Not for fans of dry table wines.,Mr. Beast,80,19,California,Dry Creek Valley,Sonoma,Zinfandel,Barber
1165,US,"Heavy and semi-sweet, with syrupy berry flavors.",,80,20,California,Mokelumne River,Central Valley,Zinfandel,Gatos Locos
1166,US,"This wine does not portend well for Rosenblum's future. It's dull and soft and earthy, with simple berry flavors.",Heritage Clones,80,17,California,California,California Other,Petite Sirah,Rosenblum
1167,Spain,"Not much good to say here. Burnt, weak aromas include raspberry, while the acidic palate tastes of cherry and plum skins. Lean and tart-sour all the way.",Albaliza,80,9,Central Spain,Tierra de Castilla,,Tempranillo-Garnacha,Tikalo
1168,Spain,"Has some serious cleanliness issues on the nose, and while it's not entirely unpalatable, it does struggle to make many positive statements. Tastes flat, mealy and bitter, and there's even some burn to it. Imported by Scoperta Importing Co. Inc.",,80,10,Central Spain,Vino de la Tierra de Castilla,,Sauvignon Blanc,Cesar Lucendo
1169,Spain,"Green and hard, with carob and ashtray aromas. The palate is simple and narrow, with sour red-fruit flavors that come to a slightly bitter ending. A defining combination of tartness and bubble gum dust isn't impressive.",,80,12,Central Spain,Almansa,,Red Blend,Higueruela
1170,Spain,"Reasonably fresh on the nose, but ultranarrow and tart in the mouth. In fact, it's borderline sour in the way it presents such linear red fruit. Tight as a drum and sheering. Can't say this is what we want from La Mancha.",,80,10,Central Spain,Vino de la Tierra de Castilla,,Shiraz,Spanish Vines
1171,Spain,"Herbal, green and grassy, with less than fresh fruit character. The palate has a weedy taste, while the finish is green and peppery. Edgy mouthfeel; barely acceptable red wine for the second straight vintage.",,80,9,Central Spain,Vino de la Tierra de Castilla,,Tempranillo,Cubo
1172,US,"Sharp and pricked, with a tartness that detracts. Also tastes like it has residual sugar, in the raspberry-mocha cookie sweetness.",Asbill Vineyard,80,35,California,Oak Knoll District,Napa,Cabernet Sauvignon,Terremoto Cellars
1173,Australia,"Light and insubstantial in the mouth, with flavors of cooked strawberries and leather. Imported by International Cellars.",Nottage Hill,80,9,Australia Other,South Eastern Australia,,Pinot Noir,Hardys
1174,Chile,"An earthy, rubbery Pinot that's not likely to sway the drinker of Burgundy any closer to Chile. This is tart, bulky stuff with size and zero subtlety.",Reserve,80,12,Central Valley,,,Pinot Noir,Peteroa
1175,Australia,"The plum and blackberry fruit is a touch stewed and the wood treatment not totally integrated, resulting in a drying, cedary finish.",,80,13,Victoria,Murray-Darling,,Merlot,Tall Poppy
1176,US,"Clumsy and awkward, with candied LifeSaver flavors and a sour finish.",,80,10,California,California,California Other,Syrah,Cline
1177,Germany,"Despite a laudable pale copper color, this wine has a rather coarse, tannic texture that dampens its melon and appleskin flavors. Turns slightly bitter on the finish.",Rüdesheimer Blanc de Noir Pinot Noir Trocken,80,15,Rheingau,,,Pinot Noir,Carl Ehrhard
