,country,description,designation,points,price,province,region_1,region_2,variety,winery
173,Italy,"This hearty red opens with aromas of leafy underbrush, leather, licorice and a hint of menthol. The firm, chewy palate offers ripe wild cherry, raspberry jam, anisette and tobacco. Brooding tannins support the dark flavors. Drink 2019–2029.",del Comune di Serralunga d'Alba,91,59,Piedmont,Barolo,,Nebbiolo,Cascina Cucco
174,Italy,"Enticing aromas of woodland berry, crushed rose, mint and menthol lead the nose on thisfull-bodied red. Mint carries over to the palate along with wild cherry, red raspberry, kitchen spice and a hint of toast. Assertive tannins and bright acidity hold it all together.",Bricco Luciani,91,85,Piedmont,Barolo,,Nebbiolo,Cascina del Monastero
175,Italy,"Aromas of French oak, coconut, vanilla and spiced plum lead the nose on this powerfully structured wine. The oak sensations carry over to the warm palate along with cherry marinated in spirits, licorice and menthol. Bracing, close-grained tannins provide the framework and need time to unwind. Best after 2020.",Bricco Gattera,91,80,Piedmont,Barolo,,Nebbiolo,Cordero di Montezemolo
176,France,"This delicious, refreshing wine is textured, tight and mineral, with fruity acidity. Tangy and crisp, it has a tight structure, touches of toast along with apple and citrus flavors. The wine is still young and very tight, so should not be drunk before 2017.",Montmains Premier Cru,91,45,Burgundy,Chablis,,Chardonnay,Domaine Gérard Duplessis
177,US,"From a multiplicity of vineyards, this wine works and is a tremendous value for the price. It mixes hot mulled-cider spices, cinnamon, clove and pine forest, conveying surprising depth. Plum, dark cherry and more clove lead to a powerful, leathery finish.",,91,22,California,Napa Valley,Napa,Cabernet Sauvignon,Eagle Glen
178,US,"The first Pinot Noir release from this producer, this is a velvety-smooth, exotic and charming wine, light on the palate despite a concentration of ripe, rich fruit. Kirsch, cherry, raspberry and cinnamon combine to make the wine invitingly lush and plush.",Bacigalupi Vineyard,91,65,California,Russian River Valley,Sonoma,Pinot Noir,Eleven Eleven
179,US,"A red Meritage driven by 73% Cabernet Sauvignon, this structured, full-bodied wine also blends in 19% Merlot, 3% Petit Verdot and 3% Malbec. Blackberry and chocolate accent chalky tannins, with bold hits of black licorice, cassis, pencil and black tea. Drink now through 2020.",Magnificat,91,50,California,Napa Valley,Napa,Meritage,Franciscan
180,US,"Bright, light oak shadings dress up this medium-bodied wine, complementing the red cherry and strawberry flavors. It's fresh, fruity and not very tannic—easy to drink and enjoy.",,86,10,California,California,California Other,Cabernet Sauvignon,Belle Ambiance
181,Portugal,"The local Baga grape, better known for producing structured red wines, also lends itself to fruity sparkling rosé. Bright acidity gives this crisp wine its tangy, red currant character. Drink now.",Marquês de Marialva Rosé Bruto,86,12,Beira Atlantico,,,Baga,Adega de Cantanhede
182,Italy,"Aromas of white spring flower, orchard fruit and citrus spill out of the glass. The fun lively palate delivers ripe yellow peach and green apple alongside a foaming mousse.",Nature,86,22,Veneto,Prosecco,,Glera,De Stefani
183,US,"A smoky scent and earthy, crisp-apple flavors make this medium-bodied wine a change of pace from the average butterball Chardonnay. It has welcome acidity and a nicely smooth texture.",Small Lot Blend,86,13,California,Mendocino County,Mendocino/Lake Counties,Chardonnay,Parducci
184,Portugal,"This family-owned estate has produced an immediately attractive entry-level wine. Lightly spiced with wood, it blends Touriga Franca, Tinta Roriz and Tinta Barroca to show black fruit, ripe tannins and bright acidity. Drink now.",Muros de Vinha,86,10,Douro,,,Portuguese Red,Quinta do Portal
185,France,"This is a smooth, soft wine that is full of black fruits and ripe tannins. The Merlot rounds out the rougher edges of the Malbec to give a rich juicy wine that will develop quickly. It is all fruit, generous and ready to drink from 2017.",Château Beauvillain-Monpezat,86,14,Southwest France,Cahors,,Malbec-Merlot,Rigal
186,US,"This is an easygoing wine that's neither too oaky nor too crisp, with a decent blend of ripe pear and baking spice flavors paired with soft, smooth texture.",,86,18,California,California,California Other,Chardonnay,The Naked Grape
187,US,"Blended with small amounts of Merlot, Cabernet Franc, Petit Verdot and Malbec, this is an austere, unfussy red made in modest quantities that has crisp red currant and cranberry flavors interwoven with cedar and dried herb.",,86,36,California,Sonoma Valley,Sonoma,Cabernet Sauvignon,Tin Barn
188,France,"Closer to Bordeaux than is Cahors, this is Malbec with a cooler visage. It has spice and stalky tannins along with plenty of acidity. The wine is bright with red berry fruits and a crisp lightly mineral aftertaste. Drink from 2018.",Pigmentum,86,15,Southwest France,Buzet,,Merlot-Malbec,Georges Vigouroux
189,France,"This is a blend of 60% Ugni Blanc and 40% Colombard that gives a deliciously light and refreshing wine. Bright and breezy, it is perfumed, herbal and full of direct citrus flavors. Drink now.",Pigmentum,86,10,Southwest France,Côtes de Gascogne,,Ugni Blanc-Colombard,Georges Vigouroux
190,Argentina,"Tropical, soapy aromas are yeasty and flat. Flavors of lychee and melon have no follow-through and finish mealy.",,80,13,Mendoza Province,Mendoza,,Chardonnay,Tres Exilios
191,Argentina,"Candied plum and red berry aromas smell like red licorice. Flavors are raisiny, with sourness and astringency.",Estate Bottled,80,5,Mendoza Province,Mendoza,,Malbec,Terrenal
192,US,"The color of castor oil, this sweet table wine offers clove and root beer flavors that cling to the finish.",Noche Sweet Table Wine,80,17,Virginia,Virginia,,Red Blend,Cooper Vineyards
193,Spain,"Right away this goes wrong; the nose is smothered with charred, burning oak that smells harsh and like chemicals. A tannic, resiny palate is barely acceptable, as are bitter, burnt, resiny blackberry flavors.",Vendimia Seleccionada,80,17,Northern Spain,Ribera del Duero,,Tempranillo,Sembro
194,Portugal,"This is a light, fruity and off-dry wine. It has splashes of lemon and sweet citrus, with a crisp finish.",,80,8,Vinho Verde,,,Portuguese White,Mapreco
195,Chile,"This smells forced and grapy, with murky undertones. Flabby on the palate, this organic red tastes nutty and earthy. An aftertaste of mulch and peanut is off base and highly questionable.",Organic,80,14,Maipo Valley,,,Carmenère,Teillery
196,US,"This wine has a rustic, unclean quality. At a high alcohol level it also tastes disjointed, all about heat without fruit.",,80,18,California,Bennett Valley,Sonoma,Sauvignon Blanc,Ektimo Vineyards
197,Chile,"This is fleshy and dilute up front, then heavy and globular in feel. Pickled melon and vegetal stone-fruit flavors finish weak.",,80,11,Central Valley,,,Sauvignon Blanc,Rai
198,Spain,"Feral, feline, sweaty aromas precede an awkward palate with bitter flavors of weedy berry, citrus fruits and pyrazines. A scallion-like quality drives the finish on this strange, bitter rosé.",Rosa de Arrocal,80,15,Northern Spain,Ribera del Duero,,Rosé,Arrocal
199,Chile,"Aromas of canned pear and peach are not fresh. This is syrupy in the mouth, with a bland mix of vanilla and melon flavors. Oxidized on the finish.",Reserva,80,12,Maule Valley,,,Chardonnay-Viognier,Oveja Negra
200,Chile,"Aromas of sweet corn and melon are not convincing. This has little in the way of mouthfeel or substance; flavors of candied fruits taste like corn and wheat, while the finish is spineless.",,80,15,Itata Valley,,,Chardonnay,Männle