,country,description,designation,points,price,province,region_1,region_2,variety,winery
659,Argentina,"Quite woody for this weight class, with balsam shavings and berry aromas that are distant. Chewy, lactic and creamy across the tongue, with a flavor profile that brings chocolate and berry syrup flavors. Finishes with a final wave of oaky spice and bitterness; good but needs more fruit.",Reserva,86,15,Mendoza Province,Maipú,,Malbec,Viamonte
660,US,"A little heavy and overripe. There's a taste of prunes and chocolate in addition to the more classic cherries. Nicely dry and complex, but lacks vibrancy. Drink now.",Cuyama River,86,28,California,Santa Maria Valley,Central Coast,Pinot Noir,Taz
661,US,"This rich wine is a great success. It's enormously rich, almost flamboyant in blackberry jam, blueberry cobbler, anise and smoky new oak, as delicious as any Cabernet out there. Yet it shows a fine structure and relatively modest alcohol, a feature of the 2008 vintage. Good as it is now, you can safely cellar it for the rest of this decade and watch it evolve.",,95,85,California,Rutherford,Napa,Cabernet Sauvignon,St. Supéry
662,Portugal,"Dark in color, this is a powerful, classic wine, with dense tannins. It has rich black-fruit flavors, and notes of wood and herb that are packed into its concentrated, dry structure. This is a great Douro for aging.",Batuta,95,100,Douro,,,Portuguese Red,Niepoort
663,France,"This legendary Madiran is, its fruit tannins just softened by wood aging. It's smoky, brooding, very concentrated, and worth aging for 10 years.",Château Montus,94,35,Southwest France,Madiran,,Tannat-Cabernet Franc,Alain Brumont
664,Italy,"This vineyard-designate Taurasi Riserva is probably one of the biggest, boldest wines produced in Italy. It opens with an inky black color and intense aromas of black fruit, toast, spice, espresso bean and bitter black chocolate. The jackhammer tannins are steady and firm, and there's a long tail of prune and black fruit on the finish.",Piano di Montevergine Riserva,94,65,Southern Italy,Taurasi,,Aglianico,Feudi di San Gregorio
665,US,"A vastly concentrated Cabernet. Frazier seems to have taken their basic Cabernet, which is an excellent wine, and intensified everything about it. With explosive blackberry, cassis, blueberry, dark chocolate and oak flavors, it's almost too much of a good thing. Your best bet is to cellar it, but that's chancy. The alcohol is very high, and we do not know how these modern Cabernets will ride out the years.",Memento,94,110,California,Napa Valley,Napa,Cabernet Sauvignon,Frazier
666,US,"So rich and ripe in fruit, you almost don't notice that it's also a complicated and layered wine in structure. Blackberry marmalade, cassis and cocoa flavors are balanced despite hefty alcohol. An extraordinarily delicious wine, but it's meant to be enjoyed in its youth. Drink up by 2016.",Generations,94,100,California,Napa Valley,Napa,Cabernet Sauvignon,Raymond
667,Portugal,"A gorgeous Port at that right stage where there is still freshness and hints of orange and dried fruits, while the wood aging is concentrating the wine into its essence. It is rich, full, yet at the same time has a great tang of spirit and acidity.",20 Year Old Tawny,94,50,Port,,,Port,Fonseca
668,Portugal,"A superb example of the quality of Touriga Nacional. This wine combines the richness of the hot Alentejo sun with the sophisticated structure of the grape. Big, juicy and richly fruity as well as perfumed and elegant. Age it for at least 2–3 years.",TN,94,35,Alentejano,,,Touriga Nacional,Herdade do Esporão
669,US,"A concentrated core of pure, sweet raspberry and cherry fruit is showcased in a wine of remarkable penetration and length. The fruit, from a biodynamic estate vineyard, is perfumed and open, making this immediately accessible and supremely enjoyable. And yet cellaring will surely reward those with the patience and discipline to lay it down for up to a decade.",de Lancellotti Vineyard,94,63,Oregon,Chehalem Mountains,Willamette Valley,Pinot Noir,Bergström
670,US,"A marvelous vintage for Freedom Hill, this high-acid Pinot is loaded with black cherry fruit. Rich, ripe, full, tart and penetrating, it might seem one-dimensional at first, but it has such excellent focus and depth that the fruit simply rocks. The finish weaves in threads of smoke and mocha, but this is a wine to cellar for a couple more years at least.",Freedom Hill Vineyard,94,50,Oregon,Willamette Valley,Willamette Valley,Pinot Noir,Ken Wright
671,Italy,"Villa Gemma is a flagship wine for Abruzzo that underlines a specific quality-minded winemaking philosophy that makes this Italian region so exciting and full of surprises. The wine is dark and superconcentrated, with amazing intensity and generous layers of mature berry fruit, spice, tobacco, used leather and polished river stone. It is smooth, firm, dense and will age many more years to come.",Villa Gemma,94,100,Central Italy,Montepulciano d'Abruzzo,,Montepulciano,Masciarelli
672,US,"Dark, full, generous and ripe to the far edge of elegance, this powerful Pinot is saturated with black fruits, annotated with fennel, pepper, smoke and espresso, the rich and varied flavors rolling right through a lush midpalate and on into a gently fading finish. Retasted over 24–48 hours, it continued to evolve and develop additional nuances. A wine to cellar for a decade or more.",Evenstad Reserve,94,65,Oregon,Willamette Valley,Willamette Valley,Pinot Noir,Domaine Serene
673,Portugal,"A big rich wine from a warm year. Its powerful, dense structure is dominated by wood aging and fine blackberry and plum fruits. There is concentration along with swathes of delicious fruit. Age it for 4–5 years.",Reserva,94,54,Alentejano,,,Portuguese Red,Herdade dos Grous
674,Portugal,"Now that the color of this superb wine has gone to old gold, it has definitely become a gloriously mature Port. The color translates into sweetness, which is allied to acidity, richness and an immense intensity due to its long wood aging.",Colheita,94,100,Port,,,Port,Niepoort
675,US,"A huge wine, almost old-fashioned in its tannins. They're so strong, they freeze the palate with astringency, like a shot of Novacaine. It's also very dry, despite sweetly ripe blackberry essence, licorice and dark chocolate. All indications are that this is an ageworthy wine. Should begin to throw sediment and mellow in seven or eight years, and could go the distance to 2020 and beyond.",,94,150,California,Howell Mountain,Napa,Cabernet Sauvignon,Notre Vin
676,US,"Dry, smooth and distinguished. Shows Mondavi's ability to get the grapes ripe in blackberries and currants, yet the fruit pulls back at the last moment, letting earthy, herbal notes take over, providing complexity and endless pleasure. The tannins are pure Oakville—sweet, soft and supple. Drink this elegant, balanced wine over the next six years.",,94,45,California,Oakville,Napa,Cabernet Sauvignon,Robert Mondavi
677,US,"Extraordinarily ripe and sweet in blackberries, cassis and figs, with a lovely perfume of violets and cedar, this soft, lush Cabernet, which was blended with some Petit Verdot, is so decadent now, you can hardly resist it. But it's pretty tannic, with good acidity, and has the structure to ride out the next eight years.",Reserve Bovet,94,95,California,Rutherford,Napa,Cabernet Sauvignon,Round Pond
678,US,"This blend of Cabernet Sauvignon, Petit Verdot and Cabernet Franc shows all the charms of the 2007 vintage. It's an opulent, delicious wine, immediately likeable now for its broad array of blackberry, cherry, raspberry, mocha, cassis and new oak flavors. The tannins are soft, but strong enough to protect this wine for the next six years at the very least.",Elivette,94,125,California,Napa,,Bordeaux-style Red Blend,Spring Mountain Vineyard
679,US,"A superb wine, showing real Oakville character. It's bone dry, rich and complex in tannin structure, with wonderfully ripe blackberry and cassis flavors. Yet there's a minerality that anchors the wine, and the finish is long, smooth and spicy. Just delicious now, and should hold over the next six years.",District Collection,94,75,California,Oakville,Napa,Cabernet Sauvignon,Raymond
680,US,"Along with the Freedom Hill bottling, the Savoya is the wine of the vintage for Ken Wright. A beautifully-crafted mix of brambly berry, thistle and herb, this textural and detailed effort keeps developing added complexity as it rolls across the palate. Blackberry, black cherry, and hints of truffle infuse the complex, deliciously satisfying finish.",Savoya Vineyard,94,50,Oregon,Yamhill-Carlton District,Willamette Valley,Pinot Noir,Ken Wright
681,US,"Pinot Noir just doesn't get richer than this. It floods the mouth with ripe flavors of raspberries and cherries, with fascinatingly earthy things, like truffles and pine cones. Vibrant acidity and a hint of furry tannins give it a fine structure. This upscale Pinot Noir is drinkable now and should evolve over the next six years.",Durell Vineyard,94,44,California,Sonoma Coast,Sonoma,Pinot Noir,De Loach
682,US,"Immaculately clean and fresh, this enters the mouth with a pleasing lightness, displaying a mix of stone fruits and a streak of vanilla wafer running right through its core. It opens in the glass, adding muscle and depth, ultimately developing into a complex and persistent wine that simply refuses to quit.",Côte Sud Vineyard,94,49,Oregon,Dundee Hills,Willamette Valley,Chardonnay,Domaine Serene
683,US,"The vineyard has been source to Pinot Noirs from Copain and Drew, and this one, from Winemaker Jon Grant shows a somewhat Cabernet-esque interpretation. The wine is dark, tannic and medium-bodied, and quite extracted in the flashily ripe cherry and cola fruit that Monument Tree ripens so well in a cool, long hangtime year like 2010. Despite the richness, this is an elegant, ageworthy wine, whose low alcohol will delight many who critique California Pinot Noir for clumsiness. Give it at least six years in a good cellar.",Monument Tree Vineyard,94,38,California,Anderson Valley,Mendocino/Lake Counties,Pinot Noir,Couloir
684,US,"De Loach reaches into Lake County, not usually thought of as Zinfandel country, with tremendous results. This is a great wine by any standard. It shows some heat from high alcohol and some shriveled raisin tastes, but that's part of a ripe Zin's charm. Mostly, you'll be impressed by waves of sweetly ripe berries, chocolate and bacon, smooth tannins and a long, spicy finish.",Nova Vineyard,94,30,California,Lake County,Mendocino/Lake Counties,Zinfandel,De Loach
685,Portugal,"Gold in color, this is a wood-aged Port. Despite being 26 years old, it is still lively, almost fruity. The wood character does certainly show strongly, but so do the delicious caramel and toffee flavors, which are balanced by an intense acidity. Like all Colheitas, it is ready to drink.",Colheita,94,80,Port,,,Port,Niepoort
686,US,"The winery doesn't reveal on the label what grape varieties are in this blend, but they're Cabernet Sauvignon and Petit Verdot. It's a fine, delicious wine, with blackberry, dark chocolate and bacon flavors, wrapped into exceedingly fine tannins. It's well-balanced, too, with moderate alcohol and a nice lick of acids. Impressive and classy from this Lake County winery.",Half Mile,94,60,California,Red Hills Lake County,Mendocino/Lake Counties,Red Blend,Obsidian Ridge
687,US,"Two-plus years in the cellar have softened and mellowed this wine, taking off the edges and giving it a nice roundness. It's quite impressive, filled with classically varietal cherry, cola and sweet persimmon fruit, while that famous Russian River acidity gives it a boost of tartness. Drink this delicious, rich wine now–2016.",Le Roi,93,44,California,Sonoma Coast,Sonoma,Pinot Noir,De Loach
688,US,"If only more Zins were this good! De Loach hits this one out of the park, with its fabulous wealth of wild berry, mocha, anise, spice, grilled meat and mushroom flavors. The high alcohol adds a wonderful varietal heat to the peppery finish.",OFS,93,30,California,Russian River Valley,Sonoma,Zinfandel,De Loach
689,France,"Dark chocolate and black currant flavors dominate this concentrated wine. It is densely tannic, while still allowing room for the brooding fruit to show through. Still young, it will age slowly and impressively over the next five years.",Collection,93,27,Southwest France,Pécharmant,,Bordeaux-style Red Blend,Domaine l'Ancienne Cure
690,US,"Joseph Jewell's 2009 Elk Prairie is even better than its 2008, which is saying something. This vintage opens with perfumed cola spice and cinnamon that evolves in its lightly textured, lush mouthfeel into decadent strawberry in crème Anglaise. Bright, with a lingering finish, this Pinot Noir only gets better while in the glass.",Elk Prairie Vineyard,93,39,California,Humboldt County,North Coast,Pinot Noir,Joseph Jewell
691,Argentina,"Starts out rubbery and gaseous, but airing helps it along. The palate is regular in feel, with no glaring faults, while the flavors of berry fruits, oak and herbal shadings are easygoing. Finishes with toast, herbal notes and a mild baked sweetness.",Del Pecado,86,12,Mendoza Province,Mendoza,,Cabernet Sauvignon-Malbec,Serrera
692,US,"Oak gives this wine a caramel-like richness, while the underlying fruit is jammy and spicy in cherries and raspberries. The result is a somewhat candied Zin. Drink it now.",Gilsson Vineyard,86,27,California,Russian River Valley,Sonoma,Zinfandel,Tin Barn
693,Italy,"This is a bright Soave Classico that offers aromas of lemon zest, freshly cut green grass and fine talc powder. It tastes fresh and zippy and has the natural crispness to pair with fried zucchini flowers stuffed with mozzarella and anchovies.",Le Volpare,86,13,Veneto,Soave Classico,,Garganega,Tommasi
694,Argentina,"Generic and generally clean, with dry berry aromas and a touch of sharpness. The palate is full, stocky and solid, with black-fruit flavors and a medicinal character. Finishes dry, woody, peppery and slightly hot, with snap and power.",,86,10,Mendoza Province,Mendoza,,Malbec,Terrazas de Los Andes
695,Italy,"Melibéo characterizes the natural freshness and easy informality of the Lugana region. The wine invites and surprises the palate with its tonic aromas of peach, pear, sage and honey. Those aromas are followed by medium consistency and perky crispness.",Melibéo,86,,Lombardy,Lugana,,Trebbiano di Lugana,Santi
696,US,"Spicy cranberry/raspberry fruit is the whole story here. It's fresh, acidic, forward and spicy, then tails off quickly into a tannic finish. The last impression is of earth and stems, slightly bitter and astringent.",Estate,86,26,Oregon,Willamette Valley,Willamette Valley,Pinot Noir,Benton-Lane
697,US,"It's all here, the ripe tropical fruit, the smoky oak, the buttered toast and vanilla and cream. Hits that Chardonnay sweet spot with pinpoint accuracy.",Coastal Series,86,18,California,California,California Other,Chardonnay,Arrow Creek
698,Italy,Here's a very attractive Sauvignon with clean aromas and a perky disposition. You can drink this wine with light vegetable dishes or raw fish and it will keep your palate fresh.,Turranio,86,,Veneto,Lison-Pramaggiore,,Sauvignon,Bosco del Merlo
699,US,"A little rough around the edges, with some irregular tannins and a few green notes, but otherwise fine and dry. The silky texture frames Life Saver cherry candy flavors.",,86,35,California,Sta. Rita Hills,Central Coast,Pinot Noir,Lincourt
700,South Africa,Forward citrus is lifted by accents of thyme and green melon rind in the bouquet. White cranberry and lime pith unfold in the medium-weight mouth and linger through the finish.,,86,28,Stellenbosch,,,Sauvignon Blanc,Hartenberg
701,US,"Good, dry and crisp, if a little simple, with apricot, citrus and vanilla flavors. There's a touch of green unripeness that detracts, but it's a pretty nice wine.",Filigreen Farm,86,20,California,Anderson Valley,Mendocino/Lake Counties,Pinot Gris,Horse & Plow
702,South Africa,"Accessible and available, this is a great value wine that's perfectly suited to grilled steak dinners with friends. Juicy dark fruit dominates the palate, with accents of bittersweet chocolate and peppery spice glimmering on the back of finish.",,86,11,Coastal Region,,,Cabernet Sauvignon,MAN Vintners
703,Italy,"Aged in stainless steel to maintain the freshness of the wine's bright fruit aromas, this is a simple easy-drinking red. The wine shows good harmony and bright cherry and blackberry flavors on the close.",,86,10,Sicily & Sardinia,Sicilia,,Nero d'Avola,MandraRossa
704,Italy,"Here's a rare and exciting blend of Bosco, Albarola and Vermentino from a cooperative winery in the beautiful Cinque Terre region of northern Italy. You won't find these native grapes anywhere else and the wine is perfectly suited to the fresh fish dishes served in this gorgeous part of the world.",,86,25,Northwestern Italy,Liguria,,White Blend,Cantina Cinque Terre
705,Italy,"This distinctive expression of Soave puts emphasis on brawn and power with aromas of mature fruit, apricot and cantaloupe. The aromatic intensity is standout and the wine follows through onto the palate with fresh intensity and playful touches of piquant spice.",La Capelina,86,,Veneto,Soave,,Garganega,Franchetto
706,US,"A rustic wine, with semisweet blackberry and cherry pie filling flavors and jagged tannins. There's a funky, barnyardy thing you'll either like or won't.",,86,22,California,Santa Ynez Valley,Central Coast,Cabernet Sauvignon,Genuine Risk
707,US,"A bit too strong in Porty, sugary raisins, but not too much, so unless you're sensitive to this, it is a pretty nice Zin. Shows plenty of spicy Dry Creek character.",Estate Bottled,86,20,California,Dry Creek Valley,Sonoma,Zinfandel,Giarusso
708,Austria,"A pale-colored wine, tasting of strawberry jam, soft tannins and acidity. It is certainly cool-climate Pinot Noir, in its light texture and likelihood of early drinking.",Steinbügel Reserve,86,35,Niederösterreich,,,Pinot Noir,Graf Hardegg
709,South Africa,"Tasty and satisfying, especially for the price, with notes of plum flesh, strawberry and blueberry in the nose and mouth. Lean but so drinkable with soft mocha and pepper spice unfolding on the solid finish. Drink now.",Young Vines,86,11,Stellenbosch,,,Shiraz,DeWaal
710,US,"A good, dry and flavorful Syrah, with lush blackberry, cherry and oak flavors. It's a harsh in the mouth, with some firm tannins, but a nice, fruity sipper to enjoy now.",Homestead,86,33,California,Monterey-Santa Cruz,Central Coast,Syrah,Big Basin
711,US,"Soft, round and pretty, this wine announces itself with a massive, deeply punted bottle. It's a pleasant effort, with tart red fruit, piercing acidity, and a lackluster, lightly herbal finish.",Angela,86,50,Oregon,Oregon,Oregon Other,Pinot Noir,Clawson Creek
712,Italy,"This is a dry, crisp and refreshing white wine with polished mineral aromas backed by peach, citrus and white flower. It has good weight and texture for an easy Soave and would work with fish, fried calamari or mussels in garlic and tomato sauce.",Rocca Sveva,86,15,Veneto,Soave Classico,,Garganega,Cantina di Soave
713,Italy,There's a sweet element to the nose of this beautiful Sicilian rosé that recalls raspberry and almond marzipan. The wine glides clean over the plate with easy freshness and leaves small berry nuances on the close.,La Bambina,86,15,Sicily & Sardinia,Sicilia,,Rosé,Cantine Barbera
714,Italy,"This blend of Grillo and Insolia (30%) offers fresh floral tones of lemon and almond blossoms. There's some pulpy, peach-like notes in the mouth and the wine also delivers a playful touch of acidity on the close.",Zagra,86,20,Sicily & Sardinia,Sicilia,,White Blend,Valle dell'Acate
715,Argentina,"A touch grassy to start, with blueberry and blackberry aromas. The palate has a clampy, tannic feel and snappy acids, while the flavors veer toward red berry, herbs, coffee and mocha. Tight and tannic on the finish, and overall it's short on body.",Reserva,86,15,Mendoza Province,Mendoza,,Malbec,Terrazas de Los Andes
716,Italy,"This Soave Classico shows a luminous golden color and subdued aromas of dried herbs and white mineral or talc powder. More fruit tones appear in the mouth, especially peach and citrus, and the wine is bright and polished on the close.",Grisela,86,18,Veneto,Soave Classico,,Garganega,Tessari
717,US,"Lots of oak on this five-year-old Syrah. Too much, in fact, although it may be that the cherry-berry fruit is simply dropping out. Either way, it's a fairly simple wine, dry and tart and spicy. Drink now.",Coryelle Fields Vineyard,86,25,California,Sonoma Coast,Sonoma,Syrah,Tin Barn
718,South Africa,"With 58% Shiraz and 42% Pinotage, this is an accessible and enjoyable Cape blend with vibrant notes of black berry, all-fruit preserves, root beer and a soft touch of caramel sauce. Cherry and fleshy plum fill the mouth, and a kiss of vanilla lingers on the close.",Cape Blend,86,8,Western Cape,,,Shiraz-Pinotage,Sebeka
719,Argentina,"Jammy raspberry aromas greet you, followed by dry spice, light oak and milk chocolate scents. The palate is warm, mildly rich and resiny, with oaky flavors of pepper, spice and black fruit. Finishes quite sweet but also peppery due to the oak treatment.",Killka,86,14,Mendoza Province,Uco Valley,,Malbec,Salentein
720,US,"The blend is half Dolcetto, 40% Baco Noir, and the rest a mix of Tempranillo and Syrah. Creative, to be sure. What emerges is a rustic, fruity, forward, simple and slightly gamy red, the sort of wine that might be served in a carafe in a Mediterranean cafe. Light and fruity, with a spicy kick to the finish.",Equinox Red Blend,86,20,Oregon,Umpqua Valley,Southern Oregon,Red Blend,Melrose
721,US,"This softly delicious, complex wine is one of the reasons why Pinot Noir has soared in popularity lately. Made from the Dijon clones that give such fruity wines in California, it's filled with raspberry, cherry and smoky cedar flavors, with the silky elegance you want from this variety. Drink this flashy wine soon, to fully appreciate the youthful fruit.",Reserve,93,57,California,Carneros,Napa-Sonoma,Pinot Noir,Frank Family
722,France,"An impressively powerful wine that balances the blackest of juicy fruit with dark, dusty and dense tannins. The right amount of wood aging and acidity are in the mix. Harmonious while still concentrated.",Cuvée Réserve de l'Aïeul,93,24,Southwest France,Cahors,,Malbec-Tannat,Château Eugénie
723,US,"Another fabulous I Block from Mondavi. Exceptionally ripe in grapefruit, lime and gooseberry fruit, it shows the minerality of this vineyard that gives the wine grip and grounding. Bone-dry, with crisp supportive acidity and just the right amount of oak, it's wonderful now. This is not a wine to age, but will hold over the next four years.",To Kalon Vineyard I-Block,93,75,California,Oakville,Napa,Fumé Blanc,Robert Mondavi
724,Portugal,"A powerfully ripe wine, full of black fruit and sumptuous tannins. Despite its youth, the wine, wearing all its charms up front, is very ready to drink. It's dark, juicy and deliciously rich.",Grande Reserva Classico,93,,Douro,,,Portuguese Red,Quinta Nova de Nossa Senhora do Carmo
725,US,"From Frank Family, this Cabernet Sauvignon-based blend was grown in Rutherford. It's marked by intense flavors of blackberry, black cherry and currant, wrapped into firm, ripe tannins, and aged in 75% new French oak barrels. A perfect wine for drinking now with a great steak.",,93,150,California,Rutherford,Napa,Bordeaux-style Red Blend,Winston Hill
726,Italy,"Vintner Riccardo Cotarella's fantastic Cabernet-based Marciliano (both Cabernets Sauvignon and Franc are present) opens with an intense bouquet of red fruit, blackberry, oak spice and chocolate. The ripeness level is spot-on; and the wine leaves a smooth, soft sensation in the mouth that's followed by firm, age-worthy tannins.",Marciliano,93,45,Central Italy,Umbria,,Red Blend,Falesco
727,Portugal,"Even the stain on the base of the cork reveals this wine's huge color. With its open richness and structure, it's comparable to a Rhône wine. Wood aging has lended notes of spice to go with the flavors of plum jelly and ripe, sweet fruit.",S,93,35,Alentejano,,,Syrah,Herdade do Esporão
728,France,"A powerful, long-term wine. Its density and great concentration all show a solid, powerful character. Jammy black fruits combine with dark tannins and acidity in an already balanced wine. Hold for 4–5 years, but with the sweet fruit, it could be consumed younger.",Notre Dame des Champs,93,34,Southwest France,Cahors,,Malbec,Domaine de Cause
729,US,"This is classic Oregon Pinot Noir at its most svelte and stylish. Fresh and clean upon entry, it showcases its raspberry and cherry fruit in a delicate wrap of leaf and bark. The tannins are in perfect proportion; the finish is complex and intriguing.",Louise Vineyard,93,50,Oregon,Eola-Amity Hills,Willamette Valley,Pinot Noir,Cristom
730,US,"Lusty, powerful, ripe and concentrated, this Zin could also be described by the old Yiddish word, zaftig. The vineyard is in a warm part of the valley, and the grapes show the influence of sun and heat in the jammy, slightly baked quality of the cherries and blackberries. It's a really fine example of Russian River Zinfandel.",Butler Vineyard,93,36,California,Russian River Valley,Sonoma,Zinfandel,De Loach
731,US,"You'll find plenty of fruit, in the way of ripe mangoes, peaches, green apples and limes, as well as a sweet coating of smoky oak. However, it's elevated by brisk acidity and a stony, tangy minerality that must come from the soil of this cool-climate vineyard.",Hawk Hill Vineyard,93,44,California,Russian River Valley,Sonoma,Chardonnay,De Loach
